,company,location,title,summary,salary
2616,North Carolina Office of State Human Resources,"Wake County, NC",Natural Science Research Curator II,"Participation in science communication initiatives, including participation in Museum educational programming, delivering public science-based presentations,...","$42,667 - $69,177 a year"
2635,All-In Analytics,"Research Triangle Park, NC",Senior Machine Learning Data Scientist,"Machine Learning Data Scientist. Proficient in programming languages such as R, SAS, Python, Matlab, SQL etc....","$140,000 - $160,000 a year"
2657,Identifize Consulting,"Charlotte, NC",Superstar Senior Quantitative Finance Analyst,"5+ years of programming experience using SAS, R, and/or SQL. 10+ years of experience in computational, engineering or scientific research or development roles....","$175,000 a year"
2660,Guilford County Government,"Greensboro, NC",Environmental Health Specialist,Graduation from a four-year college or university with 30 semester hours of course work in the physical or biological sciences and two years of experience in...,"$47,476 a year"
2681,North Carolina State University,"Raleigh, NC 27695 (West area)",Post Doctoral Scientist in Computational Genomics,A Postdoctoral position in plant genomics and bioinformatics is available to join a multidisciplinary blueberry genomic and breeding project at the North...,"$40,000 a year"
2781,UC San Diego,"San Diego, CA",Strategic Research Opportunities Analyst,"Manage scientific reviews and evaluation process for all proposals submitted, including evaluation of scientific merit and interpretation of selection of...","$57,100 - $79,300 a year"
2856,Tristaff Group,"San Diego, CA 92122","Senior FullStack Developer – PHP, ElasticSearch, Machine Lea...","The leadership team has a strong background in machine learning and data mining, so you will learn a lot in these exciting areas....","$75,000 - $110,000 a year"
2947,"IGE Therapeutics, Inc","San Diego, CA",Scientist,"The candidates working in a Team culture, are expected to be a cordial team player, skilled in both verbal and written communication, data organization and...","$53,000 a year"
3139,Intechriti,"San Jose, CA",Data Scientist (IoT Network Security),"Experience with threat intelligence analytics, malware intelligence analytics, cybersecurity analytics, OR user behavior analytics....","$160,000 a year"
3246,Umpqua Bank,"Palo Alto, CA",Pivotus Ventures - Data Scientist - Palo Alto,You will be eager to think about how machine learning and analytics can help change the ways people manage money and transact commerce....,"$100,000 - $160,000 a year"
3249,Workbridge Associates,"Palo Alto, CA",Data Scientist,A company specializing in marketing data analytics is looking for a Python data scientist to add to their growing team....,"$80,000 - $120,000 a year"
3340,State of Maryland,"Baltimore, MD",RESEARCH STATISTICIAN II,"Ability to analyze data to determine patterns or trends, track and measure program performance. You must upload official college transcripts or fax to DJS -OHR,...","$41,358 - $65,827 a year"
3386,Johns Hopkins University,"Baltimore, MD",Sr. Research Service Analyst,"Requires hands on attention to clinical research agreement process, budget negotiation, sponsor invoicing and clinical research faculty and staff guidance, to...","$47,305 - $65,105 a year"
3408,"City of Baltimore, MD","Baltimore, MD",Research Analyst II - Dept. of Public Wo...,"A Research Analyst II organizes and analyzes data of international, national and local intelligence and statistics into actionable data in a City agency....","$60,800 - $97,300 a year"
3414,Johns Hopkins University,"Baltimore, MD",Research Data Analyst,Utilize advanced scientific knowledge and experience toward specialized scientific research. Interests of Clinical Research projects in the Division of...,"$42,168 - $58,056 a year"
3417,"ADNET Systems, Inc.","Greenbelt, MD 20770",Earth Data Support Scientist - GD100,Experience visualizing scientific data or presentation of data for outreach or to a larger user community. GD100 Earth Data Support Scientist*....,"$75,000 a year"
3443,Johns Hopkins University,"Baltimore, MD",Data Scientist,"The Johns Hopkins health system includes six academic and community hospitals, four suburban health care and surgery centers, more than 30 primary health care...","$55,310 - $75,977 a year"
3530,Johns Hopkins University,"Baltimore, MD",Sr. Institutional Research Analyst,"Identifies trends, opportunities, and concerns through data analysis. Query/report building tools, data visualization software (e.g....","$49,957 - $68,721 a year"
3563,National Security Agency,"Fort George G Meade, MD",Data Scientist,"Designing/implementing machine learning, data mining, advanced analytical algorithms, programming, data science, advanced statistical analysis, artificial...","$78,549 - $104,614 a year"
3582,Johns Hopkins University,"Baltimore, MD",Biostatistician,"Collaborates with clinical and scientific investigators in protocol designs, clinical plans, data analysis plans, grant applications and preparation of...","$49,957 - $68,721 a year"
3592,Johns Hopkins University,"Baltimore, MD",Research Specialist,"Of Core resources by ALS Scientists around the world. Standardized slide sets are scanned, and the images, genetic analysis, and detailed clinical data are....","$37,040 - $50,932 a year"
3609,Prince George's Community College,"Largo, MD","Research Analyst, Institutional Research and Reporting","Work schedule is subject to change based on department needs. Under general supervision, responsible for supporting the Office of Planning, Assessment, and...","$63,863 a year"
3622,Geode Executive Search,"New York, NY","Data Scientist - Text Analytics - SQL, R, SAS","Data Scientist - Text Analytics - SQL, R, SAS*. The ~600 person company has a relatively new Data Analytics department, which has the responsibility of...","$200,000 a year"
3649,Wade & Wendy,"New York, NY",Wade & Wendy_Data Scientist/Engineer,"Software Engineering, Python, Data Visualization, Machine Learning, MySQL, Statistics, Optimization, Mathematics, MongoDB, Search, Databases, RESTful Services,...","$80,000 - $120,000 a year"
3657,Scienaptic Systems Inc,"New York, NY",Data Scientist,"As our representative in front of client, you will have the opportunity to construct and deliver high end analytics solutions delivered from a cutting edge big...","$100,000 a year"
3729,POLICE DEPARTMENT,"New York, NY",Data Analytics Research Scientist,"Extensive knowledge of applied statistics, analytics, machine learning, data science or big data tools.. For Assignment Level I (only physical, biological and...","$70,286 - $88,213 a year"
3800,CONSUMER AFFAIRS,"Manhattan, NY","Modeler/Data Scientist, Policy and Strategy","For Assignment Level I (only physical, biological and environmental sciences and public health) A master's degree from an accredited college or university with...","$59,708 - $72,246 a year"
3805,Centers for Disease Control and Prevention,"New York, NY",Health Scientist,"Whether we are protecting the American people from public health threats, researching emerging diseases, or mobilizing public health programs with our domestic...","$88,305 - $146,570 a year"
3837,HRA/DEPT OF SOCIAL SERVICES,"Manhattan, NY",DATA ANALYST,"For Assignment Level I (only physical, biological and environmental sciences and public health) A master's degree from an accredited college or university with...","$57,969 - $62,000 a year"
3858,DEPARTMENT OF TRANSPORTATION,"Manhattan, NY",Bike Share Data Scientist,"Establish and monitor best practices, policies, procedures and documentation around Citi Bike system data; Analyze software systems in a SQL Server environment...","$60,189 - $83,440 a year"
3896,Oliver James Associates,"New York, NY","Program Manager - Data Science - New York City - $165,000",The program manager will be working closely with Predictive modellers and Data Scientists to coordinate a portfolio of projects for the Data Science department....,"$165,000 a year"
3897,Harnham,"New York, NY",Senior Data Scientist - Bio-tech,"You will be expected to adopt a very hands-on approach working with large scale structured and unstructured clinical data, as well as mentoring other Data...","$170,000 a year"
4182,The University of Texas Medical Branch,"Galveston, TX",Sr. BI Analyst/Data Scientist,"BI Analyst/Data Scientist - Clinical Data Management (Galveston). Continuously research new data mining, machine learning, and analysis techniques....","$66,960 - $107,136 a year"
4188,Baylor College of Medicine,"Houston, TX",Sr. Bioinformatics Programmer,3 years’ experience in scientific programming with applications to genome research or a Master’s degree in Computer Science or Biological Sciences and 1 year of...,"$70,000 - $91,000 a year"
4219,State of South Carolina,"Richland County, SC",Statistical and Research Analyst II - 61010782/61378,"An Associate Degree in Health Information Management or related certification in ICD-9-CM coding, or associate degree with 3 years of experience or bachelor's...","$26,988 - $49,932 a year"
4225,State of South Carolina,"Richland County, SC",Statistician III - 61007667,"Performs data analysis on the various data sets in DADE, including but not limited to the electronic disease surveillance systems, National Healthcare Safety...","$39,960 - $73,935 a year"
4236,All-In Analytics,"Spartanburg, SC",Sr. Machine Learning Risk Statistician,"Analyze data, build non-parametric machine learning models and assess their quality. Mining, cleaning, segmenting, and understanding data....","$100,000 - $125,000 a year"
4268,All-In Analytics,"Spartanburg, SC",Machine Learning Risk Statistician (entry level),"Analyze data, build non-parametric machine learning models and assess their quality. Mining, cleaning, segmenting, and understanding data....","$60,000 - $75,000 a year"
4282,Lighthouse Recruiting,"Myrtle Beach, SC",LCMS Technical Supervisor,"Join our Medical Laboratory Scientists Groups:. The Laboratorian features a list of open clinical lab jobs, the latest industry news, salary information,...","$75,000 - $90,000 a year"
